,NAME,CATEGORY,RESUME
71,Mila,HR,"Computer Knowledge:  Proficient in basic use of MS office  Microsoft Dynamics AX software  SAIBA softwareEducation Details  MBA   Distance education Bharathiar University BE   PA College of Engineering and Technology HSC   R.V.G. Hr Sec School SSC   G.Hr.Sec SchoolHR Admin in BharatSkill Details DYNAMICS- Exprience - 6 monthsDYNAMICS AX- Exprience - 6 monthsMICROSOFT DYNAMICS- Exprience - 6 monthsMICROSOFT DYNAMICS AX- Exprience - 6 monthsMS OFFICE- Exprience - 6 monthsCompany Details company - Sri Ramesh Gaarmentdescription - TirupurAdministration as well as clients serviceHere corporate companies only insured so that knowledge gathered aboutGarments, spinning mills FEB 2018 to Still: Sri Ramesh Gaarment Tirupur.HR ActivitiesAttendance maintenance, Time cards maintenance,Staffs and labors individual records maintenanceProject: Advanced automobile collision avoidance and blackbox in CAR"
72,Annabelle,HR,"SOFTWARE SKILLS:  General Computer Proficiency  Program Langages known C, C+, Java, Web Programming  Tools & Software know MATLAB. DBMS KEY STRENGTHS:  Posse's Good communication and analytic skills.  Positive thinking. Sincere, Hard work, Honesty, Responsibility.  Enthusiastic to learn new skills & take up new tasks.  Self - motivated.  Ready to accept challenges Education Details January 2014 to January 2017 BE in computer science and engineering computer science engineering  Adichunchanagiri institute of technology chikmagalurHR Skill Details DATABASE MANAGEMENT SYSTEM- Exprience - 6 monthsDBMS- Exprience - 6 monthsJAVA- Exprience - 6 monthsMATLAB- Exprience - 6 monthsCompany Details company - Yours Trulydescription - Jayashree H .K)"
73,Sheri,HR,"TECHNICAL SKILLS  Typewriting  TORA  SPSSEducation Details January 2017 MBA  Chidambaram, Tamil Nadu SNS College of EngineeringJanuary 2014 HSC   at SAV Higher Secondary School MBA   SNS College of Engineering SSLC Finance  at Kamaraj Matriculation SchoolHR Skill Details Human resource, Finance- Exprience - Less than 1 year monthsCompany Details company - description - "
74,Adeline,HR,"I.T. Skills  Windows XP, Ms Office (Word, Excel: Look-ups Pivot table other basic functions  Power Point)  Saral Payment Package- payroll software  Internet ApplicationsEducation Details January 2006 Bachelor in Hospitality Management International Hospitality Management  Queen Margaret University EdinburgJanuary 2006 diploma Hotel Management  International Institute of Hotel ManagementHR Skill Details Hr Management- Exprience - Less than 1 year monthsCompany Details company - Atri Developersdescription -  HR Payroll Statutory Compliance Performance Managementcompany - description - Employee Relations and Administration: Creating industry specific Policies, Procedure, Forms, Formats, Letters, Checklists etcPayroll Management: Salary restructuring to process payroll of 600 employees. Validation of all input (Attendance, Leaves, and Salaries) before starting salary process. Processing accurate & error free salary of employees. Responsible for compensation and benefits administration. Coordinate with Accounts team for salary processing. Attendance & Leave record management Assuring prompt and satisfactory resolution of payroll related queries of all employees.Statutory Compliance Management:  Manage various statutory compliance requirements (PF, ESIC, PT, Gratuity, TDS etc calculations, deduction, payment and return filing. Generate statutory reports like Form 16, Form 24Q. Conducting session with employees on Statutory Policies and procedure, compliance related topics. Shops and Commercial Establishments Act (S&E) The Payment of Gratuity Act 1972Recruitment and Selection: Handling recruitment like job posting in naukri portal and coordination. Create annual manpower plan and budget. Screen and schedule preliminary interview. Arrange for employee orientation. Handling joining formalities and salary account opening formalities.Performance Management: End to end facilitation of PMS starting from creating Job Description & Appraisal Forms to Disbursement of Letters. KRA setting, Mid-year reviews, Annual reviews, handling all appraisal activities (360 Degree)Training and Development: Conduct training need analysis and arrange various training session.Employee engagement and  Employee Welfare: Creation and deployment  of Sales  Rewards and Recognition Schemes, Periodic Interactive sessions like Monthly Birthday Celebration, Annual Day, Diwali Dhamaka, Offsite etc.Working on Saral Payment Package- payroll software as well as on excelAssisting MD in HR works, offering suggestions and answering employee queries on payroll compliance related issues, other benefits (insurance, medical, reimbursement, ), full & final settlement of resigned employees."
75,Angie,HR,Education Details  BA   mumbai UniversityHR Skill Details Hr Operations- Exprience - Less than 1 year monthsCompany Details company - Mumbai Monoraildescription - 
76,Marcella,HR,"Education Details June 2012 to May 2015 B.A Economics Chennai, Tamil Nadu SdnbvcHr Skill Details Company Details company - Anything IT Solutiondescription - Hr"
77,Mya,HR,"Education Details June 2012 to May 2015 B.A Economics Chennai, Tamil Nadu SdnbvcHr Skill Details Company Details company - Anything IT Solutiondescription - Hr"
78,Maryann,HR,Education Details  BBA   lovely professional universityHR Skill Details Communication- Exprience - 6 monthsCompany Details company - description - 
79,Tabitha,HR,Education Details  MBA   ACN College of engineering & mgtHR Skill Details Company Details company - HR Assistantdescription - 
80,Blanche,HR,"KEY SKILLS:  Computerized accounting with tally  Sincere & hard working  Management accounting & income tax  Good communication & leadership  Two and four wheeler driving license  Internet & Ecommerce management COMPUTER SKILLS:  C Language  Web programing  Tally  Dbms Education Details June 2017 to June 2019 Mba Finance/hr India MlritJune 2014 to June 2017 Bcom Computer Hyderabad, Telangana Osmania universityJune 2012 to April 2014 Inter MEC India SrimedhavHr NaniSkill Details accounting- Exprience - 6 monthsDATABASE MANAGEMENT SYSTEM- Exprience - 6 monthsDbms- Exprience - 6 monthsManagement accounting- Exprience - 6 monthsEcommerce- Exprience - 6 monthsCompany Details company - Valuelabsdescription - They will give the RRF form the required DLT then the hand over to RLT then scrum master will take the form from the RLT then scrum master will give the forms to trainee which we can work on the requirement till the candidate receive the offer from the company"
81,Roxanne,HR,"Training in Special Education (Certificate Course) Education Details July 2016 to October 2018 M.Sc Psychology with specialization in Organizational Behaviour Malappuram, Kerala Calicut UniversityJuly 2013 to March 2016 BSc Psychology Thrissur Prajyoti Niketan CollegeHR Skill Details Company Details company - description - I have done a 30 days internship in the HR department of Foster Hot Breads, KINFRA, Malappuram, Kerala and I have also done a 60 days internship at Santhwana Institute of Counselling and Psychotherapy, Cochin, Kerala as Counsellor"
82,Luna,HR,"Computer Knowledge:  Proficient in basic use of MS office  Microsoft Dynamics AX software  SAIBA softwareEducation Details  MBA   Distance education Bharathiar University BE   PA College of Engineering and Technology HSC   R.V.G. Hr Sec School SSC   G.Hr.Sec SchoolHR Admin in BharatSkill Details DYNAMICS- Exprience - 6 monthsDYNAMICS AX- Exprience - 6 monthsMICROSOFT DYNAMICS- Exprience - 6 monthsMICROSOFT DYNAMICS AX- Exprience - 6 monthsMS OFFICE- Exprience - 6 monthsCompany Details company - Sri Ramesh Gaarmentdescription - TirupurAdministration as well as clients serviceHere corporate companies only insured so that knowledge gathered aboutGarments, spinning mills FEB 2018 to Still: Sri Ramesh Gaarment Tirupur.HR ActivitiesAttendance maintenance, Time cards maintenance,Staffs and labors individual records maintenanceProject: Advanced automobile collision avoidance and blackbox in CAR"
83,Celeste,HR,"SOFTWARE SKILLS:  General Computer Proficiency  Program Langages known C, C+, Java, Web Programming  Tools & Software know MATLAB. DBMS KEY STRENGTHS:  Posse's Good communication and analytic skills.  Positive thinking. Sincere, Hard work, Honesty, Responsibility.  Enthusiastic to learn new skills & take up new tasks.  Self - motivated.  Ready to accept challenges Education Details January 2014 to January 2017 BE in computer science and engineering computer science engineering  Adichunchanagiri institute of technology chikmagalurHR Skill Details DATABASE MANAGEMENT SYSTEM- Exprience - 6 monthsDBMS- Exprience - 6 monthsJAVA- Exprience - 6 monthsMATLAB- Exprience - 6 monthsCompany Details company - Yours Trulydescription - Jayashree H .K)"
84,Mikayla,Advocate,"TECHNICAL QUALIFICATIONS:  Windows, Ms. OfficeEducation Details  LL.B  Guwahati, Assam University Law College, Guwahati University B.Sc  Jagiroad, ASSAM, IN Jagiroad College    Morigaon CollegeAdvocate Advocate - Gauhati High CourtSkill Details Company Details company - Gauhati High Courtdescription - of the Gauhati High Court and other subordinate Courts and Tribunals and Statutory Bodies in Guwahati from 2008. Numerous experiences of Civil, Criminal cases, cases under consumer forum. Handling a good number of Civil as well as Criminal Matters in District & Sessions Judge Court, Judge Court, C.J.M. Court, and Consumer Forum & also in the High Court. Working as Executive (Legal) at Hindustan Paper Corporation Limited (A Govt. of India Enterprise), Nagaon Paper Mill since Jan '2012.STRENGTH:  Adaptability: A penchant to adapt to the conditions & level of the environment accordance with the requirement of the given situation. Interpersonal: An extrovert to the core, prefer to interact with people of all walks of life and varying strata of society. Ability to quickly establish rapport with others. Team Work: Enjoy being a part of a group & achieve combined goals.ROLES AND RESPONSIBILITIES AT HPC LTD  Assisting in briefing counsels on matters relating to Nagaon Paper Mill, Cachar Paper Mill and also Nagaland Pulp and Paper Corporation Ltd. The task of legal vetting in all NIBs/NITs terms and conditions etc. Providing Legal views to protect the interest of the Corporation. Assisting in formulation and drafting of all Disciplinary matters. Liaisoning with all local bodies and also other forums."
85,Myra,Advocate,"Education Details  B.Com, LL.B.,   University of Clacutta, University of BurdwanADVOCATE Skill Details Taxation matters Income Tax GST P Tax Accounts- Exprience - Less than 1 year monthsFiling of Income Tax Returns GST Returns e-TDS AIR and more- Exprience - Less than 1 year monthsCompany Details company - own practicedescription - 1. Drafting and preparation of plaint, Accounts and move before relevant Authority to hear the cases"
86,Eloise,Advocate,Education Details  LLB.   Dibrugarh UniversityAdvocate Skill Details Legal.- Exprience - Less than 1 year monthsCompany Details company - Legal.description -  Advocate
87,Dianna,Advocate,"Education Details November 2016 to January 2019 Llm Masters in Law Hyderabad, Telangana Sultan Ul Uloom College Of LawSeptember 2011 to May 2016 BA.llb Bachelors in Law Hyderabad, Telangana Osmania University PG College Of LawAdvocate Experienced in Litigation, Recently Acquired Masters Degree in LawSkill Details Microsoft word- Exprience - Less than 1 year monthslitigation- Exprience - Less than 1 year monthsLegal Research- Exprience - Less than 1 year monthsContracts- Exprience - Less than 1 year monthsInternet Savvy- Exprience - Less than 1 year monthsDrafting- Exprience - Less than 1 year monthsCompany Details company - LRC Officedescription -  Working under Senior Advocate L Ravichander in the High Court of Telangana. Experience in drafting Legal Correspondence"
88,Beulah,Advocate,"SKILLS  Knows English as native speaker (IELTS Overall 8 Listening 8, Reading 8, Writing 7 and Speaking 8.5) Hindi with bilingual proficiency and Punjabi as native speaker.  Able to communicate clearly and concisely with people of diverse backgrounds and levels of authority.  Exceptional knowledge of administrative procedures, evidence rules and trials.  Can maintain a professional attitude with peers, co-workers and clients at all times.  Focused and driven to always meet deadlines for pretrial procedures, trials and appellate briefings by effectively utilizing resources.  A Microsoft Certified Systems Engineer (2008) and very much Competent in Windows and Word processing software Education Details July 2009 to May 2012 Bachelor's Laws Bikaner, Rajasthan Maharaja Ganga Singh UniversityAugust 2008 to November 2008 Microsoft Certified Systems Engineer Networking Chandigarh July 2005 to April 2008 Bachelor's of Science Bio-Informatics Chandigarh, Chandigarh Panjab UniversityAdvocate Newcomer Indian AdvocateSkill Details Administration- Exprience - 72 monthsLegal Research- Exprience - 72 monthsMicrosoft Office- Exprience - 72 monthsDrafting- Exprience - 72 monthsCompany Details company - District Courtsdescription - Key Features Licensed Advocate in practice from 16-Aug-2012 (Bar Council of Punjab & Haryana, Chandigarh). Admitted to practice at District Courts, Mansa since 18-Aug-2012. Successfully passed the All India Bar Examination (AIBE) conducted by Bar Council of India (BCI) in September, 2013. Lead/Sole Counsel for plaintiff and respondents in number of criminal/civil trials. Since 2012, have prepared and prosecuted to conclusion, either by trial or settlement, number of claim cases involving personal injury or death cases. Working on the Panel of District Legal Services Authority, Mansa run under the supervision of National Legal Services Authority, India. Former Co-Opted Member Administrative Committee, Punjab. Former Joint Secretary at District Bar Association, Mansa (2017-18).Job Duties Advice clients of their legal rights and all matters related to law. Plead clients' cases which include various International companies, before courts of law, forums, tribunals and boards. Researching legal precedents, gathering evidence and trials of criminal, Injury and death compensation claims and others. Draw up legal documents such as bail petitions, appeals, divorces and contracts etc. Negotiates settlements of civil disputes. Act as mediator, conciliator, local commissioner or arbitrator as per Court orders Managing a private practice for more than 6 years, including all aspects of administration and management functions, controlling costs and achieving objectives related to the practice of law."
89,Lana,Advocate,"QUALIFICATION: Introduction to Computer EXTRAEducation Details January 2001 to January 2003 Master Law Chennai, Tamil Nadu Dr.Ambedkar Law UniversityJanuary 1998 to January 2001 Bachelor Law Chennai, Tamil Nadu Dr. Ambedkar Law UniversityJanuary 1995 to January 1998 Bachelor English Literature Tirunelveli, Tamil Nadu Manonmaniam Sundaranar universityAdvocate AdvocateSkill Details Company Details company - Practiceddescription - at High Court of Judicature at Madras, India City Civil Court, Chennai Debt Recovery Tribunal, Chennai Consumer Forums, Chennai Labour Courts Small Causes Courts Rent control Courts Legal advisor for Christian Institute of Management, Chennai in 2016 Legal Advisor for Ruah church, Chennai and NESSA Trust till 2018"
90,Aimee,Advocate,"Skills: Natural Languages: Proficient in English, Hindi and Marathi. Computer skills: Proficient with MS-Office, Internet operation.Education Details January 2015 to January 2018 LLB Law Mumbai, Maharashtra Mumbai universityJanuary 2015 B.M.M  Mumbai, Maharashtra S.K.Somaiya College, Mumbai University H.S.C   Asmita Girls junior College, Maharashtra Board S.S.C Vidya Bhawan  Maharashtra BoardAdvocate Llb student and JournalistSkill Details Company Details company - Criminal lawyer (law firm)description - "
91,Traci,Advocate,"Skills Legal Writing Efficient researcher Legal Education Family Law Criminal Defence Environment law and litigation Business legal issue Banking Law and commercial lawEducation Details January 2014 LLM Criminology Pune, Maharashtra University of PuneJanuary 2012 LLB Law Pune, Maharashtra University of PuneJanuary 2012 Diploma Labour Law Pune, Maharashtra University of PuneAdvocate AdvocateSkill Details LEGAL WRITING- Exprience - 6 monthsLITIGATION- Exprience - 6 monthsCompany Details company - Family, Criminal in District and Session Courtdescription - Legal consultancy services forCo-operative Banks, Scheduled Banks and Private BanksClientsFederal Bank (Chinchwad, Pune)Bharat Co-Operative Bank (Chinchwad, Pune)ICICI BankScope of workFinalising Loan Agreements,Mortgage agreement, Release Deed  and Notice of Intimation,Title Deed, Search ReportDRT casesLegal notices for recovery of dues,Filing Summary suitsPaper Notice,Power of AttorneyIndemnity bondFamily LawLegal Consultancy and representation for matters relating to Family disputes such as Marriage and Divorce, Succession, Adoption etc.Lok AdalatPanel Judicial Member - Four Times"
92,Allyson,Advocate,"Good grasping quality and skillful work Education Details March 2013 to March 2018 B. A. LL. B. Law Solapur, Maharashtra Solapur UniversityAdvocate Skill Details Good knowledge of typing as well as many other activities- Exprience - Less than 1 year monthsCompany Details company - District and Session court of solapurdescription - Forward thinking individual with refined interpersonal and multitasking skills. Looking to join a progressive organization to provide assistance in Legal work.company - District and Session court of solapurdescription - Provide legal assistance in legal work"
93,Paisley,Advocate," Hard working  Quick learnerEducation Details June 2014 to May 2017 LLB LAW Mumbai, Maharashtra mumbai universityJanuary 2014 B.Com Commerce Mumbai, Maharashtra Mumbai universityJanuary 2011 HSC   Maharashtra boardJanuary 2009 SSC   Maharashtra boardAdvocate Skill Details Company Details company - The vidishtradescription - "
94,Flora,Advocate,"TECHNICAL QUALIFICATIONS:  Windows, Ms. OfficeEducation Details  LL.B  Guwahati, Assam University Law College, Guwahati University B.Sc  Jagiroad, ASSAM, IN Jagiroad College    Morigaon CollegeAdvocate Advocate - Gauhati High CourtSkill Details Company Details company - Gauhati High Courtdescription - of the Gauhati High Court and other subordinate Courts and Tribunals and Statutory Bodies in Guwahati from 2008. Numerous experiences of Civil, Criminal cases, cases under consumer forum. Handling a good number of Civil as well as Criminal Matters in District & Sessions Judge Court, Judge Court, C.J.M. Court, and Consumer Forum & also in the High Court. Working as Executive (Legal) at Hindustan Paper Corporation Limited (A Govt. of India Enterprise), Nagaon Paper Mill since Jan '2012.STRENGTH:  Adaptability: A penchant to adapt to the conditions & level of the environment accordance with the requirement of the given situation. Interpersonal: An extrovert to the core, prefer to interact with people of all walks of life and varying strata of society. Ability to quickly establish rapport with others. Team Work: Enjoy being a part of a group & achieve combined goals.ROLES AND RESPONSIBILITIES AT HPC LTD  Assisting in briefing counsels on matters relating to Nagaon Paper Mill, Cachar Paper Mill and also Nagaland Pulp and Paper Corporation Ltd. The task of legal vetting in all NIBs/NITs terms and conditions etc. Providing Legal views to protect the interest of the Corporation. Assisting in formulation and drafting of all Disciplinary matters. Liaisoning with all local bodies and also other forums."
95,Eliza,Advocate,"Education Details  B.Com, LL.B.,   University of Clacutta, University of BurdwanADVOCATE Skill Details Taxation matters Income Tax GST P Tax Accounts- Exprience - Less than 1 year monthsFiling of Income Tax Returns GST Returns e-TDS AIR and more- Exprience - Less than 1 year monthsCompany Details company - own practicedescription - 1. Drafting and preparation of plaint, Accounts and move before relevant Authority to hear the cases"
96,Bernadette,Advocate,Education Details  LLB.   Dibrugarh UniversityAdvocate Skill Details Legal.- Exprience - Less than 1 year monthsCompany Details company - Legal.description -  Advocate
97,Kellie,Advocate,"Education Details November 2016 to January 2019 Llm Masters in Law Hyderabad, Telangana Sultan Ul Uloom College Of LawSeptember 2011 to May 2016 BA.llb Bachelors in Law Hyderabad, Telangana Osmania University PG College Of LawAdvocate Experienced in Litigation, Recently Acquired Masters Degree in LawSkill Details Microsoft word- Exprience - Less than 1 year monthslitigation- Exprience - Less than 1 year monthsLegal Research- Exprience - Less than 1 year monthsContracts- Exprience - Less than 1 year monthsInternet Savvy- Exprience - Less than 1 year monthsDrafting- Exprience - Less than 1 year monthsCompany Details company - LRC Officedescription -  Working under Senior Advocate L Ravichander in the High Court of Telangana. Experience in drafting Legal Correspondence"
98,Gretchen,Advocate,"SKILLS  Knows English as native speaker (IELTS Overall 8 Listening 8, Reading 8, Writing 7 and Speaking 8.5) Hindi with bilingual proficiency and Punjabi as native speaker.  Able to communicate clearly and concisely with people of diverse backgrounds and levels of authority.  Exceptional knowledge of administrative procedures, evidence rules and trials.  Can maintain a professional attitude with peers, co-workers and clients at all times.  Focused and driven to always meet deadlines for pretrial procedures, trials and appellate briefings by effectively utilizing resources.  A Microsoft Certified Systems Engineer (2008) and very much Competent in Windows and Word processing software Education Details July 2009 to May 2012 Bachelor's Laws Bikaner, Rajasthan Maharaja Ganga Singh UniversityAugust 2008 to November 2008 Microsoft Certified Systems Engineer Networking Chandigarh July 2005 to April 2008 Bachelor's of Science Bio-Informatics Chandigarh, Chandigarh Panjab UniversityAdvocate Newcomer Indian AdvocateSkill Details Administration- Exprience - 72 monthsLegal Research- Exprience - 72 monthsMicrosoft Office- Exprience - 72 monthsDrafting- Exprience - 72 monthsCompany Details company - District Courtsdescription - Key Features Licensed Advocate in practice from 16-Aug-2012 (Bar Council of Punjab & Haryana, Chandigarh). Admitted to practice at District Courts, Mansa since 18-Aug-2012. Successfully passed the All India Bar Examination (AIBE) conducted by Bar Council of India (BCI) in September, 2013. Lead/Sole Counsel for plaintiff and respondents in number of criminal/civil trials. Since 2012, have prepared and prosecuted to conclusion, either by trial or settlement, number of claim cases involving personal injury or death cases. Working on the Panel of District Legal Services Authority, Mansa run under the supervision of National Legal Services Authority, India. Former Co-Opted Member Administrative Committee, Punjab. Former Joint Secretary at District Bar Association, Mansa (2017-18).Job Duties Advice clients of their legal rights and all matters related to law. Plead clients' cases which include various International companies, before courts of law, forums, tribunals and boards. Researching legal precedents, gathering evidence and trials of criminal, Injury and death compensation claims and others. Draw up legal documents such as bail petitions, appeals, divorces and contracts etc. Negotiates settlements of civil disputes. Act as mediator, conciliator, local commissioner or arbitrator as per Court orders Managing a private practice for more than 6 years, including all aspects of administration and management functions, controlling costs and achieving objectives related to the practice of law."
99,Nadine,Advocate,"QUALIFICATION: Introduction to Computer EXTRAEducation Details January 2001 to January 2003 Master Law Chennai, Tamil Nadu Dr.Ambedkar Law UniversityJanuary 1998 to January 2001 Bachelor Law Chennai, Tamil Nadu Dr. Ambedkar Law UniversityJanuary 1995 to January 1998 Bachelor English Literature Tirunelveli, Tamil Nadu Manonmaniam Sundaranar universityAdvocate AdvocateSkill Details Company Details company - Practiceddescription - at High Court of Judicature at Madras, India City Civil Court, Chennai Debt Recovery Tribunal, Chennai Consumer Forums, Chennai Labour Courts Small Causes Courts Rent control Courts Legal advisor for Christian Institute of Management, Chennai in 2016 Legal Advisor for Ruah church, Chennai and NESSA Trust till 2018"
